{
  "format": "INVESTIMAKER_CHARACTER",
  "formatVersion": 1,
  "id": "dbfd59e0-9675-499a-aaff-a152b04abb3d",
  "name": "夢生ツムグ",
  "canvas": [
    1600,
    2400
  ],
  "appearance": {
    "body": "99c2d153-b0a0-4bf5-a8fe-e49a30537420",
    "fit": {}
  },
  "sharedColors": {
    "skin.base": "#F2D3BD",
    "eyes.left": "#4A6FA5",
    "eyes.right": "#4A6FA5",
    "hair.base": "#202028"
  },
  "equipment": [
    {
      "instanceId": "99c2d153-b0a0-4bf5-a8fe-e49a30537420",
      "partId": "dev.body_adult_standard",
      "equipped": true,
      "colors": {}
    },
    {
      "instanceId": "1b714f60-1020-4307-919c-000d9385d51b",
      "partId": "dev.face_head_01",
      "equipped": true,
      "colors": {}
    },
    {
      "instanceId": "a882c727-c182-4f2d-a0d3-0eade1da1b5d",
      "partId": "dev.face_ears_01",
      "equipped": true,
      "colors": {}
    },
    {
      "instanceId": "7b827ac4-b2ba-433c-a410-80eb76a8cc3e",
      "partId": "dev.face_nose_01",
      "equipped": true,
      "colors": {}
    },
    {
      "instanceId": "7772518e-12e4-425c-b8d9-ccdd513d3975",
      "partId": "dev.eyes_01",
      "equipped": true,
      "colors": {}
    },
    {
      "instanceId": "6ce14043-a6a0-4ada-a0ee-9ac2dde84707",
      "partId": "dev.eyebrows_01",
      "equipped": true,
      "colors": {}
    },
    {
      "instanceId": "bc77514f-a5bf-4387-869a-3813a8222c7f",
      "partId": "dev.mouth_01",
      "equipped": true,
      "colors": {}
    },
    {
      "instanceId": "ca2b017a-0b6d-41e8-8575-a699e95ae973",
      "partId": "dev.hair_back_01",
      "equipped": true,
      "colors": {}
    },
    {
      "instanceId": "563abb36-4e36-4f96-a1d3-a9ec916afcc3",
      "partId": "dev.hair_front_01",
      "equipped": false,
      "colors": {}
    },
    {
      "instanceId": "c1b253aa-9574-4e82-9762-b1b40d681363",
      "partId": "dev.socks_01",
      "equipped": true,
      "colors": {}
    },
    {
      "instanceId": "b7a60fd3-23eb-4b17-aafb-aad5db57d297",
      "partId": "dev.shoes_01",
      "equipped": true,
      "colors": {}
    },
    {
      "instanceId": "5c125575-87db-4d34-9c07-7162139a4cfc",
      "partId": "dev.pants_01",
      "equipped": true,
      "colors": {}
    },
    {
      "instanceId": "fce4df45-45be-44d8-b7ab-776940d2b114",
      "partId": "dev.shirt_01",
      "equipped": false,
      "colors": {}
    },
    {
      "instanceId": "7548ba95-0b95-43f5-bea3-a8620c98515b",
      "partId": "dev.hair_front_02",
      "equipped": true,
      "colors": {
        "base": {
          "linked": false,
          "color": "#E8D080"
        }
      }
    },
    {
      "instanceId": "858b78cd-7b66-4746-bd79-a0c6523114d2",
      "partId": "dev.shirt_02",
      "equipped": true,
      "colors": {
        "main": {
          "color": "#E60033"
        }
      }
    },
    {
      "instanceId": "a42697e5-e773-421f-939d-692fc2a82822",
      "partId": "dev.coat_01",
      "equipped": false,
      "colors": {}
    },
    {
      "instanceId": "bb68fd5f-acdb-4f1c-af68-ce64a24f8239",
      "partId": "dev.glasses_01",
      "equipped": true,
      "colors": {},
      "transform": {
        "y": -40,
        "pivot": [
          800,
          405
        ],
        "rotation": 10
      },
      "overrides": {
        "transform": [
          {
            "when": {
              "pose": {
                "arm.right": "down"
              }
            },
            "transform": {
              "y": -40,
              "rotation": 10,
              "x": 60,
              "pivot": [
                800,
                405
              ]
            }
          }
        ]
      }
    }
  ],
  "state": {
    "view": "front",
    "pose": {
      "torso": "stand",
      "arm.left": "down",
      "arm.right": "down"
    },
    "expression": {
      "eyes": "smile",
      "eyebrows": "relaxed",
      "mouth": "smile_open"
    }
  },
  "requirements": {
    "parts": [
      "dev.body_adult_standard",
      "dev.eyebrows_01",
      "dev.eyes_01",
      "dev.face_ears_01",
      "dev.face_head_01",
      "dev.face_nose_01",
      "dev.glasses_01",
      "dev.hair_back_01",
      "dev.hair_front_02",
      "dev.mouth_01",
      "dev.pants_01",
      "dev.shirt_02",
      "dev.shoes_01",
      "dev.socks_01"
    ],
    "view": [
      "front"
    ],
    "pose": {
      "arm.left": [
        "down"
      ],
      "arm.right": [
        "down"
      ],
      "torso": [
        "stand"
      ]
    },
    "fit": {},
    "state": {
      "eyebrows": [
        "relaxed"
      ],
      "eyes": [
        "smile"
      ],
      "mouth": [
        "smile_open"
      ]
    }
  }
}
